[
  {
    "id": "etec-guide-model-08-premack",
    "extraction": {
      "file": "F2 — دليل الإرشاد الطلابي (مدمج 2)",
      "page": 15,
      "rawExcerpt": "النموذج الثامن: المجال: البرامج الإرشادية. المعيار: مساعدة الطلبة على الاستفادة من برامج الإرشاد النفسي. المؤشر: يطبق استراتيجيات تعديل سلوك الطلبة. السؤال: هاني طالب بالمرحلة المتوسطة من محبي مشاهدة مباريات كرة القدم، لكن قيمة المحافظة على الصلاة لديه متدنية، فكان والده يكافئه في كل مرة يؤدي الصلاة في المسجد بالسماح له بمشاهدة مباراة كرة القدم، هذا النوع من التعزيز يسمى: أ التعزيز المتقطع. ب التحصين المتدرج. ج مبدأ بريماك. د التعزيز المتبادل. تبرير الإجابة: الإجابة الصحيحة (ج)، حيث أن مبدأ بريماك في التعزيز ينص على استخدام السلوك ذي المعدل المرتفع كمعزز لتقوية السلوك ذي المعدل المنخفض.",
      "optionsComplete": true,
      "answerStatus": "IN_SOURCE",
      "answerEvidence": "تبرير الإجابة: الإجابة الصحيحة (ج)، حيث أن مبدأ بريماك في التعزيز ينص على استخدام السلوك ذي المعدل المرتفع كمعزز لتقوية السلوك ذي المعدل المنخفض.",
      "flags": []
    },
    "question": {
      "track": "COUNSELOR",
      "category": { "code": "D4", "nameAr": "البرامج الإرشادية" },
      "topic": { "slug": "behavior-modification", "nameAr": "استراتيجيات تعديل السلوك", "subtopic": "التعزيز ومبدأ بريماك" },
      "type": "SCENARIO",
      "stem": "هاني طالب بالمرحلة المتوسطة من محبي مشاهدة مباريات كرة القدم، لكن قيمة المحافظة على الصلاة لديه متدنية، فكان والده يكافئه في كل مرة يؤدي الصلاة في المسجد بالسماح له بمشاهدة مباراة كرة القدم. هذا النوع من التعزيز يسمى:",
      "difficulty": 2,
      "difficultyNote": "تقدير تحريري مبدئي (تطبيق مباشر لمبدأ مسمى)، ويُعاير لاحقًا من إجابات الطلاب.",
      "pool": "PRACTICE",
      "origin": "SOURCE_VERBATIM",
      "answerBasis": "IN_SOURCE_FILE",
      "answerConfidence": "VERIFIED",
      "answerRef": {
        "source": "دليل المتقدم لاختبار الرخصة المهنية للإرشاد الطلابي — هيئة تقويم التعليم والتدريب (1441هـ/2020م)",
        "sourceType": "OFFICIAL",
        "rights": "OFFICIAL_PUBLIC",
        "page": "15",
        "quote": "مبدأ بريماك في التعزيز ينص على استخدام السلوك ذي المعدل المرتفع كمعزز لتقوية السلوك ذي المعدل المنخفض."
      },
      "keyNotInSource": false,
      "scorable": true,
      "explanation": "مبدأ بريماك: نجعل نشاطًا يحبه الطالب ويمارسه كثيرًا (مشاهدة المباريات = سلوك عالي التكرار) مكافأةً لا يحصل عليها إلا بعد أداء سلوك يقل عنده (الصلاة في المسجد = سلوك منخفض التكرار)، فيقوى السلوك المنخفض. هذا نص تبرير الهيئة. مفتاح التعرف عليه في أي سؤال: المعزِّز ليس هدية ولا مدحًا، بل نشاط مفضل مشروط بقاعدة «أولًا السلوك المطلوب، ثم النشاط المحبوب».",
      "explanationOrigin": "FROM_SOURCE_PLUS_AI_DRAFTED",
      "reference": "دليل الإرشاد الطلابي (الهيئة)، النموذج الثامن، ص15",
      "authoring": { "by": "SOURCE", "notes": "السؤال والمفتاح والتبرير من الدليل الرسمي؛ قاعدة التعرف وأسباب خطأ الخيارات مسودة آلية تنتظر المراجعة." },
      "options": [
        { "label": "أ", "text": "التعزيز المتقطع.", "isCorrect": false, "fromSource": true, "whyWrong": "التعزيز المتقطع جدول تعزيز يُقدَّم فيه المعزز في بعض المرات فقط. والسؤال يقول إن الأب يكافئه «في كل مرة»، فهو تعزيز مستمر لا متقطع، ثم إن السؤال يسأل عن نوع المعزز لا عن جدوله." },
        { "label": "ب", "text": "التحصين المتدرج.", "isCorrect": false, "fromSource": true, "whyWrong": "التحصين المتدرج أسلوب لعلاج القلق والمخاوف بتعريض الطالب للمثير المخيف تدريجيًا مع الاسترخاء. لا علاقة له بزيادة سلوك مرغوب عن طريق المكافأة." },
        { "label": "ج", "text": "مبدأ بريماك.", "isCorrect": true, "fromSource": true, "whyWrong": "صحيح: استُخدم سلوك محبب عالي التكرار (مشاهدة المباراة) معززًا لسلوك منخفض التكرار (الصلاة في المسجد)، وهذا تعريف مبدأ بريماك كما في تبرير الهيئة." },
        { "label": "د", "text": "التعزيز المتبادل.", "isCorrect": false, "fromSource": true, "whyWrong": "يشير عادةً إلى أن يعزز كل طرف سلوك الطرف الآخر (كما في العقود السلوكية بين طرفين). هنا طرف واحد (الأب) يعزز سلوك ابنه، ولا يوجد تبادل." }
      ],
      "concepts": ["مبدأ بريماك", "التعزيز الإيجابي", "جداول التعزيز", "التحصين التدريجي"],
      "standards": [
        { "domain": "D4 البرامج الإرشادية", "standard": "10.24.6", "text": "المؤشر 10.24.6-6: يطبق استراتيجيات تعديل سلوك الطلبة.", "confidence": "CONFIRMED" }
      ],
      "regulation": null,
      "occurrences": [
        { "source": "دليل المتقدم لاختبار الرخصة المهنية للإرشاد الطلابي — هيئة تقويم التعليم والتدريب (1441هـ/2020م)", "sourceType": "OFFICIAL", "rights": "OFFICIAL_PUBLIC", "page": 15, "yearHijri": 1441 }
      ]
    },
    "review": { "status": "PENDING_FOUNDER", "needs": ["اعتماد قاعدة التعرف وأسباب خطأ الخيارات (الجزء المضاف آليًا)"] }
  },
  {
    "id": "etec-guide-practice-02-autism-case",
    "extraction": {
      "file": "F2 — دليل الإرشاد الطلابي (مدمج 2)",
      "page": 19,
      "rawExcerpt": "السؤال الثاني: في دراسة حالة الطالب (ك.ع.) سجل المرشد الطلابي الملاحظات الأولية التالية: (الطالب بالصف الأول الابتدائي، لديه مهارة عالية في الرسم، قليل الكلام، سريع الغضب، عدواني عند استخدام أدواته أو ألعابه، يلعب بعيداً عن زملائه بالفصل، يكرر باستمرار حركات وعبارات محددة، لا يستجيب للمعلم عند مناداته باسمه، لا ينظر بعينه إلى من يتحدث معه ... ) الوصف المبدئي لحالة الطالب، يمكن أن تكون: أ طيف التوحد. ب صعوبة التعلم. ج التأخر العقلي. د تشتت الانتباه.",
      "optionsComplete": true,
      "answerStatus": "IN_SOURCE",
      "answerEvidence": "مفتاح الإجابة (ص23): السؤال ٢ — المعيار ٦.٢٤.٦ المؤشر ٤ — الإجابة (أ).",
      "flags": ["key_without_justification", "old_job_title"]
    },
    "question": {
      "track": "COUNSELOR",
      "category": { "code": "D3", "nameAr": "أدوات جمع المعلومات" },
      "topic": { "slug": "case-study", "nameAr": "دراسة الحالة", "subtopic": "التعرف المبدئي على اضطرابات النمو" },
      "type": "SCENARIO",
      "stem": "في دراسة حالة الطالب (ك.ع.) سجل المرشد الطلابي الملاحظات الأولية التالية: (الطالب بالصف الأول الابتدائي، لديه مهارة عالية في الرسم، قليل الكلام، سريع الغضب، عدواني عند استخدام أدواته أو ألعابه، يلعب بعيدًا عن زملائه بالفصل، يكرر باستمرار حركات وعبارات محددة، لا يستجيب للمعلم عند مناداته باسمه، لا ينظر بعينه إلى من يتحدث معه...). الوصف المبدئي لحالة الطالب يمكن أن يكون:",
      "difficulty": 3,
      "difficultyNote": "تقدير تحريري مبدئي (يتطلب تجميع عدة علامات في صورة واحدة)، ويُعاير لاحقًا.",
      "pool": "PRACTICE",
      "origin": "SOURCE_VERBATIM",
      "answerBasis": "IN_SOURCE_FILE",
      "answerConfidence": "VERIFIED",
      "answerRef": {
        "source": "دليل المتقدم لاختبار الرخصة المهنية للإرشاد الطلابي — هيئة تقويم التعليم والتدريب (1441هـ/2020م)",
        "sourceType": "OFFICIAL",
        "rights": "OFFICIAL_PUBLIC",
        "page": "23",
        "quote": "مفتاح الإجابة: السؤال ٢ — ٦.٢٤.٦ المؤشر ٤ — أ"
      },
      "keyNotInSource": false,
      "scorable": true,
      "explanation": "الملاحظات تجمع مجموعتي العلامات الأساسيتين لطيف التوحد: (1) قصور في التواصل والتفاعل الاجتماعي: لا يستجيب عند مناداته باسمه، ولا ينظر في عين من يحدثه، ويلعب بعيدًا عن زملائه، وقليل الكلام. (2) سلوك تكراري ومقيد: يكرر حركات وعبارات محددة، ويغضب ويعتدي عند المساس بأدواته وألعابه (تمسك شديد بالأشياء). أما المهارة العالية في الرسم فقد تظهر لدى بعضهم قدرةً متميزة في مجال محدد، وتُضعف احتمال الإعاقة الفكرية العامة. وعبارة «الوصف المبدئي» مقصودة: الموجّه لا يشخّص، بل يرجّح من دراسة الحالة ثم يحوّل للتشخيص المتخصص.",
      "explanationOrigin": "AI_DRAFTED",
      "reference": "دليل الإرشاد الطلابي (الهيئة)، السؤال التدريبي الثاني ص19، ومفتاح الإجابة ص23",
      "authoring": { "by": "SOURCE", "notes": "السؤال والمفتاح رسميان. الدليل لا يذكر تبريرًا لهذا السؤال، فالشرح كله مسودة آلية تحتاج توقيع مختص." },
      "options": [
        { "label": "أ", "text": "طيف التوحد.", "isCorrect": true, "fromSource": true, "whyWrong": "صحيح: يجتمع في الحالة قصور التواصل الاجتماعي (عدم الاستجابة للاسم، تجنب النظر، العزلة) مع السلوك التكراري والتمسك بالأشياء، وهما العلامتان الأساسيتان لطيف التوحد. وهذا هو مفتاح الهيئة." },
        { "label": "ب", "text": "صعوبة التعلم.", "isCorrect": false, "fromSource": true, "whyWrong": "صعوبة التعلم تظهر في مهارة أكاديمية محددة (القراءة أو الكتابة أو الحساب) مع ذكاء عادي، ولا تفسر ضعف التواصل الاجتماعي والسلوك التكراري وعدم الاستجابة للاسم." },
        { "label": "ج", "text": "التأخر العقلي.", "isCorrect": false, "fromSource": true, "whyWrong": "التأخر العقلي (الإعاقة الفكرية) انخفاض عام في القدرات العقلية والسلوك التكيفي. والمهارة العالية في الرسم، وكون الأعراض اجتماعية وتكرارية لا معرفية عامة، لا تدل عليه." },
        { "label": "د", "text": "تشتت الانتباه.", "isCorrect": false, "fromSource": true, "whyWrong": "تشتت الانتباه يظهر في صعوبة التركيز والاندفاعية (وقد يصاحبه فرط حركة)، لا في تجنب التواصل البصري والسلوك التكراري والانعزال عن الأقران." }
      ],
      "concepts": ["اضطراب طيف التوحد", "دراسة الحالة", "صعوبات التعلم", "الإعاقة الفكرية", "تشتت الانتباه وفرط الحركة"],
      "standards": [
        { "domain": "D3 أدوات جمع المعلومات", "standard": "6.24.6", "text": "المؤشر 6.24.6-4: يطبق مهارات دراسة الحالة (بحسب مفتاح الهيئة).", "confidence": "CONFIRMED" }
      ],
      "regulation": null,
      "occurrences": [
        { "source": "دليل المتقدم لاختبار الرخصة المهنية للإرشاد الطلابي — هيئة تقويم التعليم والتدريب (1441هـ/2020م)", "sourceType": "OFFICIAL", "rights": "OFFICIAL_PUBLIC", "page": 19, "yearHijri": 1441 },
        { "source": "أسئلة اختبار كفايات الإرشاد الطلابي 1440 — قناة كفايات الإرشاد الطلابي (تيليجرام)", "sourceType": "RECALLED_EXAM", "rights": "ANALYSIS_ONLY", "page": 1, "yearHijri": 1440,
          "rawExcerpt": "طالب في الصف الاول محب للرسم ويغضب حين تُلمس اشياءه ويلعب مع اصدقاءه ولا يستجيب عند مناداته باسمه وش الحكم المبدئي: بطء تعلم / توحد / متاخر عقليا",
          "note": "تذكّره مختبرو 1440 ثلاث مرات في الملف نفسه بصيغ مختلفة (تُحسب مرة واحدة). وملف مدمج 1 (ص16–24) نسخة من الملف نفسه، فلا يُحسب مصدرًا مستقلًا." }
      ]
    },
    "review": { "status": "PENDING_EXPERT", "needs": ["توقيع مختص (اضطرابات النمو) على الشرح", "ملاحظة: نص الهيئة يستخدم المسمى القديم «المرشد الطلابي» ويُترك حرفيًا لأنه نص رسمي"] }
  },
  {